{
  "name": "NPC-INT commonsense es",
  "version": 1,
  "language": "es",
  "description": "Relaciones generales, prudentes y explicables para activación conceptual, inferencia y generación de ideas locales.",
  "relations": [
    {"subject":"caida","predicate":"puede_causar","object":"golpe","confidence":0.78,"domain":"causalidad"},
    {"subject":"objeto_caido","predicate":"puede_causar","object":"golpe","confidence":0.84,"domain":"causalidad"},
    {"subject":"viento","predicate":"puede_causar","object":"ruido","confidence":0.58,"domain":"causalidad"},
    {"subject":"corriente_aire","predicate":"puede_mover","object":"puerta","confidence":0.72,"domain":"causalidad"},
    {"subject":"lluvia","predicate":"puede_causar","object":"charco","confidence":0.84,"domain":"causalidad"},
    {"subject":"fuga","predicate":"puede_causar","object":"charco","confidence":0.91,"domain":"causalidad"},
    {"subject":"tuberia_rota","predicate":"puede_causar","object":"fuga","confidence":0.87,"domain":"causalidad"},
    {"subject":"fuego","predicate":"produce","object":"humo","confidence":0.96,"domain":"causalidad"},
    {"subject":"fuego","predicate":"produce","object":"calor","confidence":0.95,"domain":"causalidad"},
    {"subject":"fuego","predicate":"puede_causar","object":"daño","confidence":0.95,"domain":"causalidad"},
    {"subject":"hielo","predicate":"puede_causar","object":"resbalon","confidence":0.82,"domain":"causalidad"},
    {"subject":"suelo_mojado","predicate":"puede_causar","object":"resbalon","confidence":0.87,"domain":"causalidad"},
    {"subject":"resbalon","predicate":"puede_causar","object":"caida","confidence":0.82,"domain":"causalidad"},
    {"subject":"golpe","predicate":"puede_causar","object":"dolor","confidence":0.82,"domain":"causalidad"},
    {"subject":"herida","predicate":"puede_causar","object":"dolor","confidence":0.90,"domain":"causalidad"},
    {"subject":"ruido_fuerte","predicate":"puede_causar","object":"sobresalto","confidence":0.82,"domain":"causalidad"},
    {"subject":"corte_electrico","predicate":"puede_causar","object":"oscuridad","confidence":0.90,"domain":"causalidad"},
    {"subject":"bombilla_fundida","predicate":"puede_causar","object":"oscuridad","confidence":0.83,"domain":"causalidad"},
    {"subject":"bateria_agotada","predicate":"puede_causar","object":"apagado","confidence":0.90,"domain":"causalidad"},
    {"subject":"temperatura_alta","predicate":"puede_causar","object":"sobrecalentamiento","confidence":0.83,"domain":"causalidad"},
    {"subject":"sobrecalentamiento","predicate":"puede_causar","object":"fallo","confidence":0.80,"domain":"causalidad"},
    {"subject":"lluvia","predicate":"puede_causar","object":"baja_visibilidad","confidence":0.70,"domain":"causalidad"},
    {"subject":"niebla","predicate":"reduce","object":"visibilidad","confidence":0.93,"domain":"causalidad"},
    {"subject":"oscuridad","predicate":"reduce","object":"visibilidad","confidence":0.92,"domain":"causalidad"},
    {"subject":"luz","predicate":"aumenta","object":"visibilidad","confidence":0.94,"domain":"causalidad"},
    {"subject":"alarma","predicate":"puede_indicar","object":"peligro","confidence":0.76,"domain":"causalidad"},
    {"subject":"olor_humo","predicate":"puede_indicar","object":"fuego","confidence":0.85,"domain":"causalidad"},
    {"subject":"voz","predicate":"puede_indicar","object":"persona","confidence":0.83,"domain":"causalidad"},
    {"subject":"huellas","predicate":"puede_indicar","object":"paso_reciente","confidence":0.81,"domain":"causalidad"},
    {"subject":"observacion","predicate":"produce","object":"evidencia","confidence":0.91,"domain":"causalidad"},
    {"subject":"pregunta","predicate":"produce","object":"informacion","confidence":0.84,"domain":"causalidad"},
    {"subject":"evidencia","predicate":"reduce","object":"incertidumbre","confidence":0.92,"domain":"causalidad"},
    {"subject":"arma","predicate":"puede_causar","object":"daño","confidence":0.90,"domain":"causalidad"},
    {"subject":"lluvia","predicate":"puede_causar","object":"superficie_mojada","confidence":0.86,"domain":"causalidad"},

    {"subject":"llave","predicate":"sirve_para","object":"abrir_cerradura","confidence":0.94,"domain":"objetos"},
    {"subject":"cerradura","predicate":"parte_de","object":"puerta","confidence":0.82,"domain":"objetos"},
    {"subject":"puerta_cerrada","predicate":"puede_requerir","object":"llave","confidence":0.62,"domain":"objetos"},
    {"subject":"puerta","predicate":"conecta","object":"habitacion","confidence":0.82,"domain":"objetos"},
    {"subject":"interruptor","predicate":"sirve_para","object":"controlar_circuito","confidence":0.88,"domain":"objetos"},
    {"subject":"linterna","predicate":"sirve_para","object":"iluminar","confidence":0.96,"domain":"objetos"},
    {"subject":"linterna","predicate":"requiere","object":"energia","confidence":0.88,"domain":"objetos"},
    {"subject":"bateria","predicate":"almacena","object":"energia","confidence":0.92,"domain":"objetos"},
    {"subject":"destornillador","predicate":"es_un","object":"herramienta","confidence":0.98,"domain":"objetos"},
    {"subject":"martillo","predicate":"es_un","object":"herramienta","confidence":0.98,"domain":"objetos"},
    {"subject":"alicates","predicate":"es_un","object":"herramienta","confidence":0.97,"domain":"objetos"},
    {"subject":"llave_inglesa","predicate":"es_un","object":"herramienta","confidence":0.97,"domain":"objetos"},
    {"subject":"herramienta","predicate":"es_un","object":"objeto","confidence":0.96,"domain":"objetos"},
    {"subject":"destornillador","predicate":"sirve_para","object":"ajustar_tornillo","confidence":0.94,"domain":"objetos"},
    {"subject":"martillo","predicate":"sirve_para","object":"golpear_clavo","confidence":0.94,"domain":"objetos"},
    {"subject":"alicates","predicate":"sirve_para","object":"sujetar_pieza","confidence":0.90,"domain":"objetos"},
    {"subject":"llave_inglesa","predicate":"sirve_para","object":"ajustar_tuerca","confidence":0.93,"domain":"objetos"},
    {"subject":"tornillo","predicate":"sirve_para","object":"unir_piezas","confidence":0.89,"domain":"objetos"},
    {"subject":"clavo","predicate":"sirve_para","object":"unir_piezas","confidence":0.87,"domain":"objetos"},
    {"subject":"cuerda","predicate":"sirve_para","object":"sujetar_objeto","confidence":0.86,"domain":"objetos"},
    {"subject":"mochila","predicate":"sirve_para","object":"transportar_objeto","confidence":0.95,"domain":"objetos"},
    {"subject":"botella","predicate":"sirve_para","object":"contener_liquido","confidence":0.94,"domain":"objetos"},
    {"subject":"vaso","predicate":"sirve_para","object":"contener_liquido","confidence":0.93,"domain":"objetos"},
    {"subject":"recipiente","predicate":"sirve_para","object":"contener_material","confidence":0.91,"domain":"objetos"},
    {"subject":"mapa","predicate":"sirve_para","object":"orientar","confidence":0.94,"domain":"objetos"},
    {"subject":"brujula","predicate":"sirve_para","object":"indicar_direccion","confidence":0.97,"domain":"objetos"},
    {"subject":"termometro","predicate":"sirve_para","object":"medir_temperatura","confidence":0.98,"domain":"objetos"},
    {"subject":"reloj","predicate":"sirve_para","object":"medir_tiempo","confidence":0.97,"domain":"objetos"},
    {"subject":"boton","predicate":"sirve_para","object":"activar_mecanismo","confidence":0.82,"domain":"objetos"},
    {"subject":"palanca","predicate":"sirve_para","object":"accionar_mecanismo","confidence":0.88,"domain":"objetos"},
    {"subject":"bisagra","predicate":"permite","object":"giro","confidence":0.94,"domain":"objetos"},
    {"subject":"rueda","predicate":"permite","object":"desplazamiento","confidence":0.94,"domain":"objetos"},
    {"subject":"freno","predicate":"reduce","object":"movimiento","confidence":0.91,"domain":"objetos"},

    {"subject":"jugador","predicate":"controla","object":"avatar","confidence":0.90,"domain":"juegos"},
    {"subject":"avatar","predicate":"representa","object":"jugador","confidence":0.86,"domain":"juegos"},
    {"subject":"objetivo","predicate":"orienta","object":"accion","confidence":0.88,"domain":"juegos"},
    {"subject":"regla","predicate":"limita","object":"accion","confidence":0.88,"domain":"juegos"},
    {"subject":"tutorial","predicate":"explica","object":"regla","confidence":0.86,"domain":"juegos"},
    {"subject":"interfaz","predicate":"comunica","object":"estado","confidence":0.83,"domain":"juegos"},
    {"subject":"barra_vida","predicate":"representa","object":"salud","confidence":0.93,"domain":"juegos"},
    {"subject":"mapa_juego","predicate":"muestra","object":"ubicacion","confidence":0.91,"domain":"juegos"},
    {"subject":"inventario","predicate":"contiene","object":"objeto","confidence":0.90,"domain":"juegos"},
    {"subject":"objeto_consumible","predicate":"produce","object":"efecto_temporal","confidence":0.82,"domain":"juegos"},
    {"subject":"pocion","predicate":"puede_recuperar","object":"salud","confidence":0.78,"domain":"juegos"},
    {"subject":"daño","predicate":"reduce","object":"salud","confidence":0.94,"domain":"juegos"},
    {"subject":"salud_baja","predicate":"aumenta","object":"riesgo","confidence":0.88,"domain":"juegos"},
    {"subject":"cobertura","predicate":"reduce","object":"exposicion","confidence":0.82,"domain":"juegos"},
    {"subject":"escudo","predicate":"reduce","object":"daño","confidence":0.84,"domain":"juegos"},
    {"subject":"armadura","predicate":"reduce","object":"daño","confidence":0.84,"domain":"juegos"},
    {"subject":"arma","predicate":"permite","object":"atacar","confidence":0.86,"domain":"juegos"},
    {"subject":"municion","predicate":"permite","object":"disparo","confidence":0.84,"domain":"juegos"},
    {"subject":"recarga","predicate":"restaura","object":"municion","confidence":0.90,"domain":"juegos"},
    {"subject":"enemigo","predicate":"puede_causar","object":"daño","confidence":0.76,"domain":"juegos"},